[
{"title": "De Zetter", "city": "Wormerveer", "district": "Guisveld", "local_area": "De Zetter", "bedrooms": "2", "bathrooms": "1", "furnished_status": "Complete", "type": "Apartment", "size": "75m2", "id": "463110", "details_list": "Apartment for rent: De Zetter in Wormerveer Beautiful Apartment for rent in De Zetter, Wormerveer A great addition to our property portfolio in Wormerveer. A 2 bedroom apartment (completely furnished) of approximately 75 m2 located on the De Zetter in the Guisveld area of Wormerveer . This  rental apartment in the De Zetter has the following features: Not suitable for: Sharers, Pets Cleaning: Washing machine Bathroom: Shower, Wash-basin Kitchen: Dishwasher, Microwave, Oven, Induction stove Interior: Laminate floors Parking: Free Kitchen type: Open kitchen We can be reached at  or by using the contact form. If you would like to enquire about this property or one of our others, please contact us. Our team is ready to help you. Facilities in the Apartment Dishwasher Free Induction stove Laminate floors Microwave No pets Open kitchen Oven Sharers Shower Wash-basin Washing machine", "images_urls_list": "https://www.principleproperties.nl/en/wp-content/uploads/2020/09/198356.jpg,https://www.principleproperties.nl/en/wp-content/uploads/2020/09/198356.jpg,https://www.principleproperties.nl/en/wp-content/uploads/2020/09/198345.jpg,https://www.principleproperties.nl/en/wp-content/uploads/2020/09/198343.jpg,https://www.principleproperties.nl/en/wp-content/uploads/2020/09/198346.jpg,https://www.principleproperties.nl/en/wp-content/uploads/2020/09/198348.jpg,https://www.principleproperties.nl/en/wp-content/uploads/2020/09/198347.jpg,https://www.principleproperties.nl/en/wp-content/uploads/2020/09/198349.jpg,https://www.principleproperties.nl/en/wp-content/uploads/2020/09/198351.jpg,https://www.principleproperties.nl/en/wp-content/uploads/2020/09/198350.jpg,https://www.principleproperties.nl/en/wp-content/uploads/2020/09/198342.jpg,https://www.principleproperties.nl/en/wp-content/uploads/2020/09/198355.jpg,https://www.principleproperties.nl/en/wp-content/uploads/2020/09/198353.jpg,https://www.principleproperties.nl/en/wp-content/uploads/2020/09/198352.jpg,https://www.principleproperties.nl/en/wp-content/uploads/2020/09/198341.jpg", "facilities_list": "Dishwasher,Free,Induction stove,Laminate floors,Microwave,No pets,Open kitchen,Oven,Sharers,Shower,Wash-basin,Washing machine"},
{"title": "Van Beethovensingel", "city": "Rotterdam", "district": "Hillegersberg", "local_area": "Van Beethovensingel", "bedrooms": "2", "bathrooms": "1", "furnished_status": "Complete", "type": "Apartment", "size": "85m2", "id": "461148", "details_list": "Apartment for rent: Van Beethovensingel in Rotterdam Apartment for rent in Van Beethovensingel Rotterdam One of many studios, apartments, houses and villas in Rotterdam. A 2 bedroom apartment (completely furnished) of approximately 85 m2 located on the Van Beethovensingel in the Hillegersberg neighborhood of Rotterdam . This rental apartment in the Van Beethovensingel features the following: Bathroom: Bath tub, Separate toilet, Shower, Sink Kitchen: Dishwasher, Microwave, Oven, Refrigerator, Separate Freezer Outside space: Balcony, Balcony (front) Livingroom: Television Laundry room: Washing machine, Dryer Parking: Free Kitchen type: Separate This apartment is offered by Principle Vastgoed. Van Beethovensingel is located in the Hillegersberg area. This beautiful, green suburb north-east of the city is extremely popular with expats and locals alike. House prices in Hillegersberg reflect its attractiveness and its chic, upmarket reputation. Several international schools are located here, and the commute to the city centre is a mere 10 minutes by public transport. Facilities in the Apartment Balcony Balcony (front) Bath tub Dishwasher Dryer Free Microwave Oven Refrigerator Separate Separate Freezer Separate toilet Shower Sink Television Washing machine", "images_urls_list": "https://www.principleproperties.nl/en/wp-content/uploads/2020/09/152021.jpg,https://www.principleproperties.nl/en/wp-content/uploads/2020/09/152021.jpg,https://www.principleproperties.nl/en/wp-content/uploads/2020/09/152014.jpg,https://www.principleproperties.nl/en/wp-content/uploads/2020/09/152017.jpg,https://www.principleproperties.nl/en/wp-content/uploads/2020/09/152013.jpg,https://www.principleproperties.nl/en/wp-content/uploads/2020/09/152019.jpg,https://www.principleproperties.nl/en/wp-content/uploads/2020/09/152035.jpg,https://www.principleproperties.nl/en/wp-content/uploads/2020/09/152032.jpg,https://www.principleproperties.nl/en/wp-content/uploads/2020/09/152034.jpg,https://www.principleproperties.nl/en/wp-content/uploads/2020/09/152038.jpg,https://www.principleproperties.nl/en/wp-content/uploads/2020/09/152039.jpg,https://www.principleproperties.nl/en/wp-content/uploads/2020/09/152022.jpg,https://www.principleproperties.nl/en/wp-content/uploads/2020/09/152023.jpg,https://www.principleproperties.nl/en/wp-content/uploads/2020/09/152024.jpg,https://www.principleproperties.nl/en/wp-content/uploads/2020/09/152025.jpg,https://www.principleproperties.nl/en/wp-content/uploads/2020/09/152027.jpg,https://www.principleproperties.nl/en/wp-content/uploads/2020/09/152028.jpg,https://www.principleproperties.nl/en/wp-content/uploads/2020/09/152045.jpg,https://www.principleproperties.nl/en/wp-content/uploads/2020/09/152031.jpg,https://www.principleproperties.nl/en/wp-content/uploads/2020/09/152029.jpg,https://www.principleproperties.nl/en/wp-content/uploads/2020/09/152030.jpg,https://www.principleproperties.nl/en/wp-content/uploads/2020/09/152046.jpg,https://www.principleproperties.nl/en/wp-content/uploads/2020/09/152048.jpg", "facilities_list": "Balcony,Balcony (front),Bath tub,Dishwasher,Dryer,Free,Microwave,Oven,Refrigerator,Separate,Separate Freezer,Separate toilet,Shower,Sink,Television,Washing machine"},
{"title": "van breestraat", "city": "Amsterdam", "district": "Oud Zuid", "local_area": "Van Breestraat", "bedrooms": "1", "bathrooms": "1", "furnished_status": "Complete", "type": "Apartment", "size": "60m2", "id": "463171", "details_list": "Apartment for rent: van breestraat in Amsterdam Beautiful Apartment for rent in Van breestraat, Amsterdam A special property brought to you by our portfolio partner in Amsterdam. A 1 bedroom apartment (completely furnished) of approximately 60 m2 located on the Van breestraat in the Oud Zuid area of Amsterdam . This interesting rental apartment in the Van breestraat has the following features: We can be reached at  or by using the contact form. Van breestraat is located in the Oud Zuid area. Oud Zuid is one of the more prestigious parts of the city to live in. The famous museums are located here: van Gogh, Stedelijk and Rijksmuseum. Also the very popular Vondelpark, the  exclusive shops at the P.C. Hooftstraat and many cafes and restaurants are just a few minutes away. To discuss your requirements, please do not hesitate to contact us. Facilities in the Apartment", "images_urls_list": "https://www.principleproperties.nl/en/wp-content/uploads/2020/09/199454.jpg,https://www.principleproperties.nl/en/wp-content/uploads/2020/09/199454.jpg,https://www.principleproperties.nl/en/wp-content/uploads/2020/09/199455.jpg,https://www.principleproperties.nl/en/wp-content/uploads/2020/09/199456.jpg,https://www.principleproperties.nl/en/wp-content/uploads/2020/09/199457.jpg,https://www.principleproperties.nl/en/wp-content/uploads/2020/09/199458.jpg"},
{"title": "de lairessestraat", "city": "Amsterdam", "district": "Zuid", "local_area": "de lairessestraat", "bedrooms": "1", "bathrooms": "1", "furnished_status": "Complete", "type": "Apartment", "size": "55m2", "id": "463170", "details_list": "Apartment for rent: de lairessestraat in Amsterdam Facilities in the Apartment Lift No pets Paid Separate Sharers Shower Wash-basin Wooden floors", "images_urls_list": "https://www.principleproperties.nl/en/wp-content/uploads/2020/09/199433.jpg,https://www.principleproperties.nl/en/wp-content/uploads/2020/09/199433.jpg,https://www.principleproperties.nl/en/wp-content/uploads/2020/09/199434.jpg,https://www.principleproperties.nl/en/wp-content/uploads/2020/09/199435.jpg,https://www.principleproperties.nl/en/wp-content/uploads/2020/09/199436.jpg,https://www.principleproperties.nl/en/wp-content/uploads/2020/09/199437.jpg,https://www.principleproperties.nl/en/wp-content/uploads/2020/09/199438.jpg,https://www.principleproperties.nl/en/wp-content/uploads/2020/09/199439.jpg,https://www.principleproperties.nl/en/wp-content/uploads/2020/09/199440.jpg,https://www.principleproperties.nl/en/wp-content/uploads/2020/09/199441.jpg,https://www.principleproperties.nl/en/wp-content/uploads/2020/09/199442.jpg", "facilities_list": "Lift,No pets,Paid,Separate,Sharers,Shower,Wash-basin,Wooden floors"},
{"title": "John Franklinstraat", "badge_status": "Under Offer", "city": "Amsterdam", "district": "De Baarsjes", "local_area": "John Franklinstraat", "bedrooms": "1", "bathrooms": "1", "furnished_status": "Complete", "type": "Apartment", "size": "50m2", "id": "462269", "details_list": "Apartment for rent: John Franklinstraat in Amsterdam Apartment for rent in John Franklinstraat Amsterdam One of many studios, apartments, houses and villas in Amsterdam. A 1 bedroom apartment (completely furnished) of approximately 50 m2 located on the John Franklinstraat in the De Baarsjes neighborhood of Amsterdam . This property has a magnificent atmosphere and a modern interior. This rental apartment in the John Franklinstraat features the following: Bathroom: Toilet in bathroom, Shower, Sink Kitchen: Dishwasher, Microwave, Oven, Refrigerator, 4 Burner stove Outside space: Balcony Interior: Wood floors, Trendy Livingroom: Television Storage: Ample storage Laundry room: Washing machine Parking: Paid Kitchen type: Separate This apartment is offered by Principle Vastgoed. John Franklinstraat is located in the De Baarsjes area. Situated just West of Amsterdam’s city center, this neighborhood offers cultural diversity and a large student community. Good price/quality ratio and ample choice of cozy ethnic restaurants. Two large parks are close by offering possibilities for cycling, skating and walking. Facilities in the Apartment 4 Burner stove Ample storage Balcony Dishwasher Microwave Oven Paid Permit waiting list Refrigerator Separate Shower Sink Television Toilet in bathroom Trendy Washing machine Wood floors", "images_urls_list": "https://www.principleproperties.nl/en/wp-content/uploads/2020/09/176474.jpg,https://www.principleproperties.nl/en/wp-content/uploads/2020/09/176474.jpg,https://www.principleproperties.nl/en/wp-content/uploads/2020/09/176472.jpg,https://www.principleproperties.nl/en/wp-content/uploads/2020/09/176473.jpg,https://www.principleproperties.nl/en/wp-content/uploads/2020/09/176475.jpg,https://www.principleproperties.nl/en/wp-content/uploads/2020/09/176477.jpg,https://www.principleproperties.nl/en/wp-content/uploads/2020/09/176476.jpg,https://www.principleproperties.nl/en/wp-content/uploads/2020/09/176478.jpg,https://www.principleproperties.nl/en/wp-content/uploads/2020/09/176486.jpg,https://www.principleproperties.nl/en/wp-content/uploads/2020/09/176487.jpg,https://www.principleproperties.nl/en/wp-content/uploads/2020/09/176485.jpg,https://www.principleproperties.nl/en/wp-content/uploads/2020/09/176488.jpg,https://www.principleproperties.nl/en/wp-content/uploads/2020/09/176489.jpg,https://www.principleproperties.nl/en/wp-content/uploads/2020/09/176493.jpg,https://www.principleproperties.nl/en/wp-content/uploads/2020/09/176494.jpg,https://www.principleproperties.nl/en/wp-content/uploads/2020/09/176480.jpg,https://www.principleproperties.nl/en/wp-content/uploads/2020/09/176482.jpg,https://www.principleproperties.nl/en/wp-content/uploads/2020/09/176484.jpg,https://www.principleproperties.nl/en/wp-content/uploads/2020/09/176490.jpg,https://www.principleproperties.nl/en/wp-content/uploads/2020/09/176491.jpg,https://www.principleproperties.nl/en/wp-content/uploads/2020/09/176492.jpg", "facilities_list": "4 Burner stove,Ample storage,Balcony,Dishwasher,Microwave,Oven,Paid,Permit waiting list,Refrigerator,Separate,Shower,Sink,Television,Toilet in bathroom,Trendy,Washing machine,Wood floors"},
{"title": "keizersgracht", "city": "Amsterdam", "district": "Historical Centrum", "local_area": "Keizersgracht", "bedrooms": "1", "bathrooms": "1", "furnished_status": "Complete", "type": "Apartment", "size": "45m2", "id": "463175", "details_list": "Apartment for rent: keizersgracht in Amsterdam Striking Apartment for rent in Keizersgracht , Amsterdam A charming residence offered as part of our exclusive portfolio in Amsterdam. A 1 bedroom apartment (completely furnished) of approximately 45 m2 located on the Keizersgracht  in the Historical Centrum area of Amsterdam . This striking rental apartment in the Keizersgracht  has the following features: We can be reached at  or by using the contact form. Keizersgracht  is located in the Historical Centrum area. The historical center is one the most desired areas of Amsterdam. It is the vibrant heart of the city with a vast choice of restaurants, cafes, and clubs. Specialty shops are abundant in the many narrow streets and the city’s famous architecture can best be viewed by a stroll along the canals or a boat tour. Parking garages can be found close by. To discuss your requirements, please do not hesitate to contact us. Facilities in the Apartment", "images_urls_list": "https://www.principleproperties.nl/en/wp-content/uploads/2020/09/199503.jpg,https://www.principleproperties.nl/en/wp-content/uploads/2020/09/199503.jpg,https://www.principleproperties.nl/en/wp-content/uploads/2020/09/199504.jpg,https://www.principleproperties.nl/en/wp-content/uploads/2020/09/199498.jpg,https://www.principleproperties.nl/en/wp-content/uploads/2020/09/199501.jpg,https://www.principleproperties.nl/en/wp-content/uploads/2020/09/199499.jpg,https://www.principleproperties.nl/en/wp-content/uploads/2020/09/199500.jpg"},
{"title": "Steve Bikoplein", "city": "Amsterdam", "district": "Oost", "local_area": "Steve Bikoplein", "bedrooms": "1", "bathrooms": "1", "furnished_status": "Complete", "type": "Apartment", "size": "75m2", "id": "3479", "details_list": "Apartment for rent: Steve Bikoplein in Amsterdam Beautiful Apartment for rent in Steve Bikoplein, Amsterdam One of a wide range of carefully selected studios, apartments, houses and villas in Amsterdam. A 1 bedroom apartment (completely furnished) of approximately 75 m2 located on the Steve Bikoplein in the Oost area of Amsterdam . This striking rental apartment in the Steve Bikoplein has the following features: Bathroom: Bath tub, Separate toilet Kitchen: Dishwasher, Microwave, Oven Outside space: Balcony Interior: Wood floors, Fireplace Livingroom: DVD player Utilities: Cable TV, Internet Laundry room: Washing machine, Dryer Kitchen type: Open kitchen We can be reached at 085 273 6730 or by using the contact form. Steve Bikoplein is located in the Oost area. Oost offers a lively mix of cultural diversity. Amsterdam’s city centre is close by and well served by public transport. The nearby Oosterpark is one of the city’s more relaxed parks that is hardly visited by tourists. The many stalls at the nearby great open-air market, the Dappermarkt, sell fruit, vegetables and clothes. For more information on this property, please contact our team. Facilities in the Apartment Balcony Bath tub Cable TV Dishwasher Dryer DVD player Fireplace Internet Microwave Open kitchen Oven Separate toilet Washing machine Wooden floors", "images_urls_list": "https://www.principleproperties.nl/en/wp-content/uploads/2020/09/75093.jpg,https://www.principleproperties.nl/en/wp-content/uploads/2020/09/75093.jpg,https://www.principleproperties.nl/en/wp-content/uploads/2020/09/75094.jpg,https://www.principleproperties.nl/en/wp-content/uploads/2020/09/75095.jpg,https://www.principleproperties.nl/en/wp-content/uploads/2020/09/75096.jpg,https://www.principleproperties.nl/en/wp-content/uploads/2020/09/75097.jpg,https://www.principleproperties.nl/en/wp-content/uploads/2020/09/75098.jpg,https://www.principleproperties.nl/en/wp-content/uploads/2020/09/75099.jpg,https://www.principleproperties.nl/en/wp-content/uploads/2020/09/75102.jpg,https://www.principleproperties.nl/en/wp-content/uploads/2020/09/75100.jpg,https://www.principleproperties.nl/en/wp-content/uploads/2020/09/75101.jpg", "facilities_list": "Balcony,Bath tub,Cable TV,Dishwasher,Dryer,DVD player,Fireplace,Internet,Microwave,Open kitchen,Oven,Separate toilet,Washing machine,Wooden floors"},
{"title": "keizersgracht", "city": "Amsterdam", "district": "Historical Centrum", "local_area": "Keizersgracht", "bedrooms": "1", "bathrooms": "1", "furnished_status": "Complete", "type": "Apartment", "size": "49m2", "id": "463167", "details_list": "Apartment for rent: keizersgracht in Amsterdam Beautiful Apartment for rent in Keizersgracht, A great addition to our property portfolio in . A 1 bedroom apartment (completely furnished) of approximately 49 m2 located on the Keizersgracht in . This engaging rental apartment in the Keizersgracht has the following features: We can be reached at  or by using the contact form. For more information on this property, please contact our team. Facilities in the Apartment Balcony Dishwasher Microwave Open kitchen Oven Paid Separate Shower Water view", "images_urls_list": "https://www.principleproperties.nl/en/wp-content/uploads/2020/09/199416.jpg,https://www.principleproperties.nl/en/wp-content/uploads/2020/09/199416.jpg,https://www.principleproperties.nl/en/wp-content/uploads/2020/09/199415.jpg,https://www.principleproperties.nl/en/wp-content/uploads/2020/09/199417.jpg,https://www.principleproperties.nl/en/wp-content/uploads/2020/09/199418.jpg,https://www.principleproperties.nl/en/wp-content/uploads/2020/09/199419.jpg,https://www.principleproperties.nl/en/wp-content/uploads/2020/09/199420.jpg", "facilities_list": "Balcony,Dishwasher,Microwave,Open kitchen,Oven,Paid,Separate Shower,Water view"},
{"title": "Molenweg", "city": "Amstelveen", "district": "Amstelveen", "local_area": "Molenweg", "bedrooms": "3", "bathrooms": "2", "furnished_status": "Complete", "type": "House", "size": "130m2", "id": "463050", "details_list": "House for rent: Molenweg in Amstelveen Striking House for rent in Molenweg, Amstelveen A charming residence offered as part of our exclusive portfolio in Amstelveen. A big 3 bedroom house (completely furnished) of approximately 130 m2 located on the Molenweg in the Amstelveen area of Amstelveen . This striking rental house in the Molenweg has the following features: Not suitable for: Pets Neighborhood: Quiet street Cleaning: Washing machine Bathroom: Double wash-basin, Toilet in bathroom, Shower Kitchen: Oven, Refrigerator, Quooker, 4 Burner stove Outside space: Garden Interior: Wooden floors Livingroom: Fireplace, Television Kitchen type: Open kitchen Second Bathroom: Separate Shower, Sink We can be reached at  or by using the contact form. Molenweg is located in the Amstelveen area. Amstelveen is a quiet, green residential suburb located to the south of Amsterdam. The International School of Amstelveen is located here and the beautiful Amsterdam Forest provides a haven for dog walkers, cyclists, joggers and anyone looking for an escape to nature.  Amstelveen has several large shopping centres and is well connected by public transport to Amsterdam's city centre and Schiphol Airport (10 minutes by car). Parking in the area is generally free and parking permits, where required, are typically available immediately. If you would like to enquire about this property or one of our others, please contact us. Our team is ready to help you. Facilities in the House 4 Burner stove Double wash-basin Fireplace Garden No pets Open kitchen Oven Quiet street Quooker Refrigerator Separate Shower Shower Sink Television Toilet in bathroom Washing machine Wooden floors", "images_urls_list": "https://www.principleproperties.nl/en/wp-content/uploads/2020/09/196940.jpg,https://www.principleproperties.nl/en/wp-content/uploads/2020/09/196940.jpg,https://www.principleproperties.nl/en/wp-content/uploads/2020/09/196941.jpg,https://www.principleproperties.nl/en/wp-content/uploads/2020/09/196939.jpg,https://www.principleproperties.nl/en/wp-content/uploads/2020/09/196938.jpg,https://www.principleproperties.nl/en/wp-content/uploads/2020/09/196936.jpg,https://www.principleproperties.nl/en/wp-content/uploads/2020/09/196935.jpg,https://www.principleproperties.nl/en/wp-content/uploads/2020/09/196937.jpg,https://www.principleproperties.nl/en/wp-content/uploads/2020/09/196942.jpg,https://www.principleproperties.nl/en/wp-content/uploads/2020/09/196943.jpg,https://www.principleproperties.nl/en/wp-content/uploads/2020/09/196944.jpg,https://www.principleproperties.nl/en/wp-content/uploads/2020/09/196945.jpg,https://www.principleproperties.nl/en/wp-content/uploads/2020/09/196946.jpg,https://www.principleproperties.nl/en/wp-content/uploads/2020/09/196949.jpg,https://www.principleproperties.nl/en/wp-content/uploads/2020/09/196950.jpg,https://www.principleproperties.nl/en/wp-content/uploads/2020/09/196948.jpg,https://www.principleproperties.nl/en/wp-content/uploads/2020/09/196951.jpg,https://www.principleproperties.nl/en/wp-content/uploads/2020/09/196952.jpg,https://www.principleproperties.nl/en/wp-content/uploads/2020/09/196962.jpg,https://www.principleproperties.nl/en/wp-content/uploads/2020/09/196958.jpg,https://www.principleproperties.nl/en/wp-content/uploads/2020/09/196959.jpg,https://www.principleproperties.nl/en/wp-content/uploads/2020/09/196963.jpg,https://www.principleproperties.nl/en/wp-content/uploads/2020/09/196960.jpg,https://www.principleproperties.nl/en/wp-content/uploads/2020/09/196957.jpg,https://www.principleproperties.nl/en/wp-content/uploads/2020/09/196961.jpg,https://www.principleproperties.nl/en/wp-content/uploads/2020/09/196956.jpg,https://www.principleproperties.nl/en/wp-content/uploads/2020/09/196955.jpg,https://www.principleproperties.nl/en/wp-content/uploads/2020/09/196954.jpg,https://www.principleproperties.nl/en/wp-content/uploads/2020/09/196964.jpg,https://www.principleproperties.nl/en/wp-content/uploads/2020/09/196947.jpg,https://www.principleproperties.nl/en/wp-content/uploads/2020/09/196953.jpg", "facilities_list": "4 Burner stove,Double wash-basin,Fireplace,Garden,No pets,Open kitchen,Oven,Quiet street,Quooker,Refrigerator,Separate Shower,Shower,Sink,Television,Toilet in bathroom,Washing machine,Wooden floors"},
{"title": "Korte Prinsengracht", "city": "Amsterdam", "district": "the Jordaan", "local_area": "Korte Prinsengracht", "bedrooms": "1", "bathrooms": "1", "furnished_status": "Complete", "type": "Apartment", "size": "50m2", "id": "462635", "details_list": "Apartment for rent: Korte Prinsengracht in Amsterdam Striking Apartment for rent in Korte Prinsengracht, Amsterdam A special property brought to you by our portfolio partner in Amsterdam. A 1 bedroom apartment (completely furnished) of approximately 50 m2 located on the Korte Prinsengracht in the Jordaan area of Amsterdam . This property has a remarkable atmosphere and a new interior. This interesting rental apartment in the Korte Prinsengracht has the following features: Not suitable for: Sharers, Pets Building: Newly renovated Bathroom: Toilet in bathroom, Shower, Wash-basin Kitchen: Dishwasher, Microwave, Oven, Refrigerator, Induction stove Interior: Wooden floors, Trendy Livingroom: Television Storage: Ample storage Laundry room: Washing machine Kitchen type: Open kitchen We can be reached at 085 273 6730 or by using the contact form. Korte Prinsengracht is located in the Jordaan area. The Jordaan is where Amsterdammers most want to live. Lots of cosy cafes and any type of restaurant can be found here. Specialty shops are abundant in the many narrow streets. The Europarking garage is within walking distance as is most of the city centre. To discuss your requirements, please do not hesitate to contact us. Facilities in the Apartment Ample storage Dishwasher Induction stove Microwave Newly renovated No pets Open kitchen Oven Refrigerator Sharers Shower Television Toilet in bathroom Trendy Wash-basin Washing machine Wooden floors", "images_urls_list": "https://www.principleproperties.nl/en/wp-content/uploads/2020/09/186064.jpg,https://www.principleproperties.nl/en/wp-content/uploads/2020/09/186064.jpg,https://www.principleproperties.nl/en/wp-content/uploads/2020/09/186067.jpg,https://www.principleproperties.nl/en/wp-content/uploads/2020/09/186062.jpg,https://www.principleproperties.nl/en/wp-content/uploads/2020/09/186065.jpg,https://www.principleproperties.nl/en/wp-content/uploads/2020/09/186063.jpg,https://www.principleproperties.nl/en/wp-content/uploads/2020/09/186066.jpg", "facilities_list": "Ample storage,Dishwasher,Induction stove,Microwave,Newly renovated,No pets,Open kitchen,Oven,Refrigerator,Sharers,Shower,Television,Toilet in bathroom,Trendy,Wash-basin,Washing machine,Wooden floors"},
{"title": "Brielselaan", "city": "Rotterdam", "district": "Feijenoord", "local_area": "Brielselaan", "bedrooms": "3", "bathrooms": "1", "furnished_status": "Complete", "type": "House", "size": "120m2", "id": "11713", "details_list": "House for rent: Brielselaan in Rotterdam Striking House for rent in Brielselaan, Rotterdam A great addition to our property portfolio in Rotterdam. A 3 bedroom house (completely furnished) of approximately 120 m2 located on the Brielselaan in the Feijenoord area of Rotterdam . This  rental house in the Brielselaan has the following features: Bathroom: Bath tub, Separate toilet Kitchen: Dishwasher, Microwave, Oven Outside space: Roof terrace Interior: Wooden floors Storage: Separate storage Utilities: Cable TV, Internet Laundry room: Washing machine Parking: Paid, Permit immediately, Direct available Kitchen type: Open kitchen We can be reached at  or by using the contact form. Brielselaan is located in the Feijenoord area. Feijenoord was developed between 1870 and 1880 and became a significant shipbuilding centre at the time. Today's Feijenoord residents enjoy an attractive combination of urban and 'green' living, making it popular with families and starters. A mix of older properties and new developments can be found here, and connections via PlusTram and bus make commuting to the city centre quick and easy. There is convenient access by car to the A15 to Europoort and the A16 to The Hague and Dordrecht. If you would like to enquire about this property or one of our others, please contact us. Our team is ready to help you. Facilities in the House Bath tub Cable TV Direct available Dishwasher Internet Microwave Open kitchen Oven Paid Permit immediately Roof terrace Separate storage Separate toilet Washing machine Wooden floors", "images_urls_list": "https://www.principleproperties.nl/en/wp-content/uploads/2020/09/199506.jpg,https://www.principleproperties.nl/en/wp-content/uploads/2020/09/199506.jpg,https://www.principleproperties.nl/en/wp-content/uploads/2020/09/199507.jpg,https://www.principleproperties.nl/en/wp-content/uploads/2020/09/199509.jpg,https://www.principleproperties.nl/en/wp-content/uploads/2020/09/199508.jpg,https://www.principleproperties.nl/en/wp-content/uploads/2020/09/199510.jpg,https://www.principleproperties.nl/en/wp-content/uploads/2020/09/159358.jpg,https://www.principleproperties.nl/en/wp-content/uploads/2020/09/159357.jpg,https://www.principleproperties.nl/en/wp-content/uploads/2020/09/199511.jpg,https://www.principleproperties.nl/en/wp-content/uploads/2020/09/199512.jpg,https://www.principleproperties.nl/en/wp-content/uploads/2020/09/159375.jpg,https://www.principleproperties.nl/en/wp-content/uploads/2020/09/159374.jpg,https://www.principleproperties.nl/en/wp-content/uploads/2020/09/159369.jpg,https://www.principleproperties.nl/en/wp-content/uploads/2020/09/199505.jpg,https://www.principleproperties.nl/en/wp-content/uploads/2020/09/76420.jpg", "facilities_list": "Bath tub,Cable TV,Direct available,Dishwasher,Internet,Microwave,Open kitchen,Oven,Paid,Permit immediately,Roof terrace,Separate storage,Separate toilet,Washing machine,Wooden floors"}
]